{
  "checked": "2026-10-17",
  "data": { "@mdn/browser-compat-data": "8.1.6", "web-features": "3.43.0" },
  "floor": {
    "chrome": "125",
    "chrome_android": "125",
    "edge": "125",
    "firefox": "126",
    "firefox_android": "126",
    "safari": "17.4",
    "safari_ios": "17.4"
  },
  "features": [
    {
      "id": "cascade-layers",
      "syntax": "@layer",
      "kind": "css",
      "bcd": ["css.at-rules.layer"],
      "adoption": "foundation",
      "status": "implemented",
      "usedBy": ["Generated token CSS"],
      "baseline": "Declarations live in odd.tokens.",
      "tests": [{ "file": "packages/tokens/test/cascade.browser.test.ts", "name": "unlayered" }]
    },
    {
      "id": "text-wrap-balance",
      "syntax": "text-wrap: balance",
      "kind": "css",
      "bcd": ["css.properties.text-wrap.balance"],
      "adoption": "enhancement",
      "status": "planned",
      "milestone": "M10",
      "baseline": "Normal wrapping.",
      "enhanced": "Balanced heading lines.",
      "gate": "@supports (text-wrap: balance)",
      "differences": "Line breaks differ; content and size are unchanged."
    },
    {
      "id": "if-function",
      "syntax": "if()",
      "kind": "css",
      "bcd": ["css.types.if"],
      "adoption": "experimental",
      "status": "evaluated",
      "baseline": "Not used.",
      "decision": "Isolated experiments only."
    }
  ]
}
